{
  "schema_version": "1.0",
  "name": "story-gpu-cuda-oom",
  "kind": "replay",
  "description": "GPU 正向回放：可信设备映射 + 直接 CUDA OOM 错误证据（replayed 来源）；无 GPU 硬件时的诚实降级验证",
  "timeout_seconds": 180,
  "topology": {
    "resources": [
      {"ref": "host", "kind": "host", "provider": "zsvirt", "source_id": "story-gpu-host-1", "display_name": "host-1", "provenance": "replayed"},
      {"ref": "vm", "kind": "vm", "provider": "zsvirt", "source_id": "story-gpu-vm-1", "display_name": "vm-1", "provenance": "replayed"},
      {"ref": "gpu", "kind": "gpu", "provider": "zsvirt", "source_id": "story-gpu-gpu-1", "display_name": "GPU-0", "provenance": "replayed", "attributes": {"uuid": "GPU-8a2f1c9e-7742-4b61-9c3d-5e1f2a3b4c5d", "memory_total_bytes": 8589934592}},
      {"ref": "vgpu", "kind": "vgpu", "provider": "zsvirt", "source_id": "story-gpu-vgpu-1", "display_name": "vGPU-vm-1", "provenance": "replayed"},
      {"ref": "agent", "kind": "container", "provider": "docker", "source_id": "story-gpu-container-agent", "display_name": "demo-agent", "provenance": "replayed"},
      {"ref": "si", "kind": "service_instance", "provider": "otel", "source_id": "story-gpu-si", "display_name": "demo-agent 实例", "provenance": "replayed"}
    ],
    "relationships": [
      {"from": "host", "type": "hosts", "to": "vm", "valid_from": "+0s", "provenance": "replayed"},
      {"from": "vm", "type": "attached_to", "to": "vgpu", "valid_from": "+0s", "provenance": "replayed"},
      {"from": "vgpu", "type": "backed_by", "to": "gpu", "valid_from": "+0s", "provenance": "replayed"},
      {"from": "vm", "type": "contains", "to": "agent", "valid_from": "+0s", "provenance": "replayed"},
      {"from": "agent", "type": "runs", "to": "si", "valid_from": "+0s", "provenance": "replayed"}
    ]
  },
  "events": [
    {
      "schema_version": "1.0",
      "event_id": "story-gpu-mapping",
      "event_type": "gpu.device_mapping.observed",
      "resource_ref": {"namespace": "zsvirt.vgpu", "external_id": "story-gpu-vgpu-1"},
      "occurred_at": "2026-09-21T00:00:05Z",
      "observed_at": "2026-09-21T00:00:05Z",
      "severity": "info",
      "source": "replay:story-gpu-cuda-oom",
      "provenance": "replayed",
      "attributes": {"gpu_uuid": "GPU-8a2f1c9e-7742-4b61-9c3d-5e1f2a3b4c5d", "vm_id": "story-gpu-vm-1", "mapping_trusted": true},
      "scenario": {"name": "story-gpu-cuda-oom", "offset": "+5s"}
    },
    {
      "schema_version": "1.0",
      "event_id": "story-gpu-cuda-oom",
      "event_type": "gpu.cuda_oom",
      "resource_ref": {"namespace": "docker.container", "external_id": "story-gpu-container-agent"},
      "occurred_at": "2026-09-21T00:00:12Z",
      "observed_at": "2026-09-21T00:00:12Z",
      "severity": "critical",
      "source": "replay:story-gpu-cuda-oom",
      "provenance": "replayed",
      "attributes": {"error": "CUDA out of memory", "requested_bytes": 4294967296, "gpu_uuid": "GPU-8a2f1c9e-7742-4b61-9c3d-5e1f2a3b4c5d"},
      "scenario": {"name": "story-gpu-cuda-oom", "offset": "+12s"}
    },
    {
      "schema_version": "1.0",
      "event_id": "story-gpu-task-failed",
      "event_type": "task.failed",
      "resource_ref": {"namespace": "otel.service_instance", "external_id": "story-gpu-si"},
      "occurred_at": "2026-09-21T00:00:14Z",
      "observed_at": "2026-09-21T00:00:14Z",
      "severity": "error",
      "source": "replay:story-gpu-cuda-oom",
      "provenance": "replayed",
      "correlation": {"task_id": "story-gpu-task-1"},
      "attributes": {"error_class": "cuda_oom"},
      "scenario": {"name": "story-gpu-cuda-oom", "offset": "+14s"}
    }
  ],
  "expected_assertions": [
    {"path": "gpu_oom_evidence_present", "operator": "equals", "expected": true},
    {"path": "trusted_mapping_present", "operator": "equals", "expected": true}
  ]
}
